{
    "$schema": "https://json-schema.org/draft/2020-12/schema",
    "$id": "https://example.com/cooking-runtime-recipe.v2.1.schema.json",
    "title": "Cooking Runtime Recipe v2.1",
    "type": "object",
    "additionalProperties": false,
    "required": [
        "id",
        "title",
        "servings",
        "ingredients",
        "phases"
    ],
    "properties": {
        "id": {
            "type": "string",
            "minLength": 1
        },
        "title": {
            "type": "string",
            "minLength": 1
        },
        "recipeCategory": {
            "type": "string",
            "enum": [
                "stovetop",
                "baking",
                "dessert",
                "airfryer",
                "beverage",
                "other"
            ]
        },
        "equipment": {
            "type": "array",
            "items": {
                "type": "string",
                "minLength": 1
            }
        },
        "servings": {
            "type": "integer",
            "minimum": 1
        },
        "ingredients": {
            "type": "array",
            "minItems": 1,
            "items": {
                "$ref": "#/$defs/ingredientGroup"
            }
        },
        "phases": {
            "type": "array",
            "minItems": 1,
            "items": {
                "$ref": "#/$defs/phase"
            }
        }
    },
    "$defs": {
        "ingredientGroup": {
            "type": "object",
            "additionalProperties": false,
            "required": [
                "title",
                "icon",
                "items"
            ],
            "properties": {
                "title": {
                    "type": "string",
                    "minLength": 1
                },
                "icon": {
                    "type": "string",
                    "minLength": 1
                },
                "items": {
                    "type": "array",
                    "minItems": 1,
                    "items": {
                        "$ref": "#/$defs/ingredientItem"
                    }
                }
            }
        },
        "ingredientItem": {
            "type": "object",
            "additionalProperties": false,
            "required": [
                "name",
                "canonicalName",
                "amount",
                "unit"
            ],
            "properties": {
                "name": {
                    "type": "string",
                    "minLength": 1
                },
                "canonicalName": {
                    "type": "string",
                    "minLength": 1
                },
                "shoppingKey": {
                    "type": "string",
                    "minLength": 1
                },
                "amount": {
                    "oneOf": [
                        {
                            "type": "number",
                            "exclusiveMinimum": 0
                        },
                        {
                            "type": "string",
                            "minLength": 1
                        }
                    ]
                },
                "unit": {
                    "type": "string",
                    "minLength": 1
                },
                "displayAmount": {
                    "type": "string",
                    "minLength": 1
                },
                "displayUnit": {
                    "type": "string",
                    "minLength": 1
                },
                "notes": {
                    "type": "string"
                },
                "preparation": {
                    "type": "string"
                },
                "isFlexible": {
                    "type": "boolean",
                    "default": false
                },
                "isOptional": {
                    "type": "boolean",
                    "default": false
                },
                "purchasable": {
                    "type": "boolean",
                    "default": true
                }
            }
        },
        "phase": {
            "type": "object",
            "additionalProperties": false,
            "required": [
                "id",
                "number",
                "title",
                "emoji",
                "purpose",
                "steps"
            ],
            "properties": {
                "id": {
                    "type": "string",
                    "minLength": 1
                },
                "number": {
                    "type": "string",
                    "pattern": "^FASE\\s+[0-9]+$"
                },
                "title": {
                    "type": "string",
                    "minLength": 1
                },
                "emoji": {
                    "type": "string",
                    "minLength": 1
                },
                "purpose": {
                    "type": "string",
                    "minLength": 1
                },
                "steps": {
                    "type": "array",
                    "minItems": 1,
                    "items": {
                        "$ref": "#/$defs/step"
                    }
                }
            }
        },
        "step": {
            "oneOf": [
                {
                    "$ref": "#/$defs/stepLeaf"
                },
                {
                    "$ref": "#/$defs/stepGroup"
                }
            ]
        },
        "stepLeaf": {
            "type": "object",
            "additionalProperties": false,
            "required": [
                "id",
                "kind",
                "text"
            ],
            "properties": {
                "id": {
                    "type": "string",
                    "minLength": 1
                },
                "kind": {
                    "type": "string",
                    "enum": [
                        "action",
                        "timer",
                        "result"
                    ]
                },
                "text": {
                    "type": "string",
                    "minLength": 1
                },
                "container": {
                    "type": "string",
                    "minLength": 1
                },
                "timerSec": {
                    "type": "integer",
                    "minimum": 1
                },
                "result": {
                    "type": "string",
                    "minLength": 1
                },
                "ingredients": {
                    "type": "array",
                    "items": {
                        "$ref": "#/$defs/stepIngredientRef"
                    }
                }
            },
            "allOf": [
                {
                    "if": {
                        "properties": {
                            "kind": {
                                "const": "timer"
                            }
                        },
                        "required": [
                            "kind"
                        ]
                    },
                    "then": {
                        "required": [
                            "timerSec"
                        ]
                    }
                },
                {
                    "if": {
                        "properties": {
                            "kind": {
                                "const": "result"
                            }
                        },
                        "required": [
                            "kind"
                        ]
                    },
                    "then": {
                        "required": [
                            "result"
                        ]
                    }
                }
            ]
        },
        "stepGroup": {
            "type": "object",
            "additionalProperties": false,
            "required": [
                "id",
                "kind",
                "title",
                "substeps"
            ],
            "properties": {
                "id": {
                    "type": "string",
                    "minLength": 1
                },
                "kind": {
                    "const": "group"
                },
                "title": {
                    "type": "string",
                    "minLength": 1
                },
                "substeps": {
                    "type": "array",
                    "minItems": 1,
                    "items": {
                        "$ref": "#/$defs/step"
                    }
                }
            }
        },
        "stepIngredientRef": {
            "type": "object",
            "additionalProperties": false,
            "required": [
                "name",
                "canonicalName",
                "amount",
                "unit"
            ],
            "properties": {
                "name": {
                    "type": "string",
                    "minLength": 1
                },
                "canonicalName": {
                    "type": "string",
                    "minLength": 1
                },
                "shoppingKey": {
                    "type": "string",
                    "minLength": 1
                },
                "amount": {
                    "oneOf": [
                        {
                            "type": "number",
                            "exclusiveMinimum": 0
                        },
                        {
                            "type": "string",
                            "minLength": 1
                        }
                    ]
                },
                "unit": {
                    "type": "string",
                    "minLength": 1
                },
                "displayAmount": {
                    "type": "string",
                    "minLength": 1
                },
                "displayUnit": {
                    "type": "string",
                    "minLength": 1
                },
                "notes": {
                    "type": "string"
                },
                "preparation": {
                    "type": "string"
                },
                "isFlexible": {
                    "type": "boolean",
                    "default": false
                },
                "isOptional": {
                    "type": "boolean",
                    "default": false
                }
            }
        }
    }
}